{
  "schemaVersion": 1,
  "recordType": "agent-runner-real-infrastructure-decision",
  "generation": 1,
  "generationId": "sha256:368cc2823edc43553e1cd0871b35a29ad0f2f846389ea3eaf35f4eca7d542594",
  "current": {
    "exactSourceRevision": "bc4e58a2f9986b88a7eb84b191d85824c926f9f7",
    "changeClassification": "verification-support-only",
    "artifactContractChanged": false,
    "s3SdkOrPersistenceChanged": false,
    "iamBoundaryChanged": false,
    "encryptionChanged": false,
    "lifecycleChanged": false,
    "changeTriggeredRealS3": {
      "result": "NOT_REQUIRED_WITH_REASON",
      "decisionRationale": "No artifact contract, S3 SDK/persistence, IAM boundary, encryption, or lifecycle trigger changed after Phase 50 closure; Phase 51 changes are verification support/documentation only.",
      "rawEvidenceReference": null
    },
    "systemReleaseMandatory": {
      "realS3": true,
      "environmentConformance": true
    }
  },
  "history": [],
  "supersedes": null
}
