{
  "schemaVersion": 1,
  "recordType": "agent-runner-rc-verification",
  "generation": 1,
  "generationId": "sha256:6c47a1bd8acd5651e311879c322c31b0d2877e995418957625192eae70292a1c",
  "current": {
    "componentVersion": "0.0.0",
    "exactSourceRevision": "bc4e58a2f9986b88a7eb84b191d85824c926f9f7",
    "gateIdentity": {
      "repository": "mcp-mamono210/ai-agent-runner",
      "sourceRevision": "bc4e58a2f9986b88a7eb84b191d85824c926f9f7",
      "command": "npm run verify:phase50:environment",
      "contractBoundary": "current canonical release-quality / Phase 50 verification gate"
    },
    "result": "PASS",
    "environmentConformanceResult": "PASS",
    "handoffConsumerProfile": {
      "schemaVersion": 1,
      "profileId": "ready-for-agent-handoff-v1",
      "lifecycle": {
        "fieldName": "Agent Brief Lifecycle",
        "readyForAgentValue": "Ready for Agent"
      },
      "approval": {
        "approvedBy": {
          "fieldName": "Brief Approved By",
          "constraint": {
            "constraintId": "redmine-principal-v1",
            "valueType": "string",
            "required": true,
            "representation": "redmine-user:<positive-base10-integer>",
            "pattern": "^redmine-user:[1-9][0-9]*$",
            "allowEmpty": false
          }
        },
        "approvedAt": {
          "fieldName": "Brief Approved At",
          "constraint": {
            "constraintId": "rfc3339-offset-timestamp-v1",
            "valueType": "string",
            "required": true,
            "representation": "RFC3339 timestamp with Z or numeric offset",
            "format": "rfc3339-offset-timestamp",
            "pattern": "^[0-9]{4}-[0-9]{2}-[0-9]{2}T[0-9]{2}:[0-9]{2}:[0-9]{2}(?:\\.[0-9]+)?(?:Z|[+-][0-9]{2}:[0-9]{2})$",
            "allowEmpty": false
          }
        },
        "approvedBriefRevision": {
          "fieldName": "Approved Brief Revision",
          "constraint": {
            "constraintId": "positive-safe-base10-integer-v1",
            "valueType": "string",
            "required": true,
            "representation": "positive base-10 integer without sign or leading zero",
            "pattern": "^[1-9][0-9]*$",
            "minimum": 1,
            "allowEmpty": false
          }
        },
        "approvedPersistedRevision": {
          "fieldName": "Approved Persisted Revision",
          "constraint": {
            "constraintId": "nonblank-opaque-string-v1",
            "valueType": "string",
            "required": true,
            "representation": "opaque nonblank string",
            "allowEmpty": false
          }
        },
        "approvedRequirementsFingerprint": {
          "fieldName": "Approved Req Fingerprint",
          "constraint": {
            "constraintId": "sha256-lowercase-hex-v1",
            "valueType": "string",
            "required": true,
            "representation": "sha256:<64 lowercase hexadecimal characters>",
            "pattern": "^sha256:[0-9a-f]{64}$",
            "allowEmpty": false
          }
        }
      },
      "customFieldSemantics": {
        "scalarRequired": true,
        "uniqueExactNameRequired": true
      },
      "handoffIdentity": {
        "requiredFields": [
          "repository",
          "redmine_issue_id",
          "brief_revision",
          "persisted_revision",
          "requirements_fingerprint",
          "approver_identity",
          "approved_at"
        ]
      },
      "requirementsFingerprint": {
        "contractId": "agent-brief-requirements-fingerprint",
        "format": "sha256:<64 lowercase hexadecimal characters>",
        "inputFormatVersion": 1,
        "canonicalizationSemantics": "Phase 39 canonical JSON serialization derived from the bounded Phase 36 generation input; SHA-256 over UTF-8 bytes; updated_on is not a freshness signal"
      },
      "constraints": {
        "redmine-principal-v1": {
          "valueType": "string",
          "positive": [
            "redmine-user:1",
            "redmine-user:42"
          ],
          "negative": [
            "",
            "redmine-user:0",
            "redmine-user:-1",
            "Redmine-user:42",
            "user:42"
          ]
        },
        "rfc3339-offset-timestamp-v1": {
          "valueType": "string",
          "positive": [
            "2026-09-22T00:00:00Z",
            "2026-09-22T09:00:00+09:00",
            "2026-09-22T09:00:00.123+09:00"
          ],
          "negative": [
            "",
            "2026-09-22",
            "2026-09-22T09:00:00",
            "2026/09/22 09:00:00+09:00"
          ]
        },
        "positive-safe-base10-integer-v1": {
          "valueType": "string",
          "positive": [
            "1",
            "42",
            "9007199254740991"
          ],
          "negative": [
            "",
            "0",
            "-1",
            "+1",
            "01",
            "1.0",
            "9007199254740992"
          ]
        },
        "nonblank-opaque-string-v1": {
          "valueType": "string",
          "positive": [
            "opaque-persisted-revision",
            "a"
          ],
          "negative": [
            "",
            " ",
            "\t",
            "\n"
          ]
        },
        "sha256-lowercase-hex-v1": {
          "valueType": "string",
          "positive": [
            "sha256:aaaaaaaaaaaaaaaaaaaaaaaaaaaaaaaaaaaaaaaaaaaaaaaaaaaaaaaaaaaaaaaa"
          ],
          "negative": [
            "",
            "aaaaaaaaaaaaaaaaaaaaaaaaaaaaaaaaaaaaaaaaaaaaaaaaaaaaaaaaaaaaaaaa",
            "sha256:AAAAAAAAAAAAAAAAAAAAAAAAAAAAAAAAAAAAAAAAAAAAAAAAAAAAAAAAAAAAAAAA",
            "sha256:abc",
            "sha256:gggggggggggggggggggggggggggggggggggggggggggggggggggggggggggggggg"
          ]
        }
      },
      "contractReferences": [
        {
          "contractId": "agent-brief-release-handoff",
          "semanticRevision": 1
        },
        {
          "contractId": "agent-brief-lifecycle",
          "semanticRevision": 1
        },
        {
          "contractId": "agent-brief-redmine-mapping",
          "semanticRevision": 1
        },
        {
          "contractId": "agent-brief-requirements-fingerprint",
          "semanticRevision": 1
        }
      ]
    },
    "constraintConformance": {
      "result": "PASS",
      "matchedConstraintIds": {
        "approvedBy": "redmine-principal-v1",
        "approvedAt": "rfc3339-offset-timestamp-v1",
        "approvedBriefRevision": "positive-safe-base10-integer-v1",
        "approvedPersistedRevision": "nonblank-opaque-string-v1",
        "approvedRequirementsFingerprint": "sha256-lowercase-hex-v1"
      }
    },
    "requirementsFingerprintExpectedImplementationSources": [
      {
        "repository": "mcp-mamono210/redmine",
        "sourceRevision": "2b2bd1c42f1caaf876da02da0adc67dd698ddff4",
        "path": "src/agent-brief/generation-input.ts",
        "blobSha": "a99b84a72eb4bcd21137121ae996ba700608f67c"
      },
      {
        "repository": "mcp-mamono210/redmine",
        "sourceRevision": "2b2bd1c42f1caaf876da02da0adc67dd698ddff4",
        "path": "src/agent-brief/requirements-fingerprint.ts",
        "blobSha": "4b0f174f12552f7bf7f4882b917e0276a5fff0c5"
      }
    ],
    "productionBindings": {
      "handoffValidationEntryPoint": {
        "repository": "mcp-mamono210/ai-agent-runner",
        "module": "src/agent-brief/handoff-binding.ts",
        "exportedSymbol": "Phase46HandoffValidator",
        "sourceRevision": "bc4e58a2f9986b88a7eb84b191d85824c926f9f7",
        "blobSha": "5f1f9e86f1ddcd18d786f94c3369d37c85cdb58f"
      },
      "requirementsFingerprintEntryPoint": {
        "repository": "mcp-mamono210/ai-agent-runner",
        "module": "src/agent-brief/requirements-fingerprint-compat.ts",
        "exportedSymbol": "calculateAgentBriefRequirementsFingerprintCompat",
        "sourceRevision": "bc4e58a2f9986b88a7eb84b191d85824c926f9f7",
        "blobSha": "c0daf413b908a6468d396d26d70df5c806738ec9"
      }
    },
    "probeBindings": {
      "consumerProfileProbe": "scripts/phase51/agent-runner-consumer-profile.mjs",
      "productionHandoffValidationProbe": "scripts/phase51/agent-runner-handoff-validation-probe.mjs",
      "requirementsFingerprintCompatibilityProbe": "scripts/phase51/agent-runner-requirements-fingerprint-probe.mjs",
      "phase50BaselineVerificationProbe": "scripts/phase51/agent-runner-phase50-baseline-probe.mjs"
    },
    "phase50Baseline": {
      "result": "PASS",
      "baselinePath": "docs/contracts/phase50-contract-baseline.json",
      "finalVerificationPath": "docs/verification/phase50-final-verification-20260921.json",
      "phase50TestedRevision": "6619b5e11ee12757e38efc1f3250f0fc2166b5bd",
      "phase50EvidenceCommitRevision": "ee59371604529a1971fc1e3c2c01accb02e5e771",
      "environmentConformance": {
        "record": "docs/verification/phase50-environment-conformance.json",
        "testedGitRevision": "6619b5e11ee12757e38efc1f3250f0fc2166b5bd",
        "s3": {
          "result": "PASS",
          "unresolvedCoverageGap": false
        },
        "sandbox": {
          "result": "PASS",
          "unresolvedCoverageGap": false
        },
        "alternateCoverage": {
          "result": "PASS",
          "contractAffectingCoverageExecuted": true,
          "contractNeutralEvidenceRecorded": true
        }
      }
    },
    "documentationReadiness": {
      "readme": "PASS",
      "changelog": "PASS",
      "responsibilityBoundary": "PASS",
      "duplicateCanonicalCompatibilitySoT": false
    },
    "rawEvidenceReferences": [
      {
        "kind": "phase50-environment-conformance",
        "testedGitRevision": "bc4e58a2f9986b88a7eb84b191d85824c926f9f7",
        "generatedAt": "2026-09-22T15:29:06.567Z",
        "result": "PASS"
      }
    ],
    "executedAt": "2026-09-22T15:29:06.567Z"
  },
  "history": [],
  "supersedes": null
}
