{
  "schemaVersion": 1,
  "recordType": "agent-runner-rc-identity",
  "generation": 1,
  "generationId": "sha256:a565aaf9a4ff364ca8e2d028ab3b9e8bf115abe403efa6843277be8e42666262",
  "current": {
    "componentVersion": "0.0.0",
    "exactSourceRevision": "bc4e58a2f9986b88a7eb84b191d85824c926f9f7",
    "previousComponentIdentity": {
      "phase50ClosureRevision": "15e2683ecd3a6571930d79bcabbfbf6d95d628c2",
      "phase50TestedRevision": "6619b5e11ee12757e38efc1f3250f0fc2166b5bd",
      "phase50EvidenceCommitRevision": "ee59371604529a1971fc1e3c2c01accb02e5e771",
      "componentVersion": "0.0.0"
    },
    "runtimeArtifactComparison": {
      "baselineRevision": "15e2683ecd3a6571930d79bcabbfbf6d95d628c2",
      "result": "UNCHANGED",
      "changedRuntimePaths": []
    },
    "publicContractComparison": {
      "baselineRevision": "15e2683ecd3a6571930d79bcabbfbf6d95d628c2",
      "result": "UNCHANGED",
      "changedContractPaths": []
    },
    "versionDecision": "REUSE_CURRENT_COMPONENT_VERSION",
    "decisionRationale": "Only documentation, tests, or verification-support files changed after Phase 50 closure; the Agent Runner runtime artifact and externally observable component contract are unchanged.",
    "sameAsMilestoneVersion": false,
    "sameVersionIndependentRationale": "not-required: component version differs from the v0.4.0 system milestone",
    "requiredContractIdentities": [
      {
        "contractId": "agent-brief-release-handoff",
        "repository": "mcp-mamono210/redmine",
        "path": "docs/contracts/agent-brief-release-handoff-contract.md",
        "semanticRevision": 1,
        "sourceRevision": "facfacebd6854651721eb41aaff8cdb4e5a3cdfa",
        "sourceBlobSha": "5bec79e9198913fee8823d49bce8095899e93861",
        "registrationState": "committed"
      },
      {
        "contractId": "agent-brief-lifecycle",
        "repository": "mcp-mamono210/redmine",
        "path": "docs/contracts/agent-brief-lifecycle-contract.md",
        "semanticRevision": 1,
        "sourceRevision": "facfacebd6854651721eb41aaff8cdb4e5a3cdfa",
        "sourceBlobSha": "438cc4c6fcd346e7eef355e030fb844f2f1a6157",
        "registrationState": "committed"
      },
      {
        "contractId": "agent-brief-redmine-mapping",
        "repository": "mcp-mamono210/redmine",
        "path": "docs/contracts/agent-brief-redmine-mapping-contract.md",
        "semanticRevision": 1,
        "sourceRevision": "facfacebd6854651721eb41aaff8cdb4e5a3cdfa",
        "sourceBlobSha": "1fc06a63664456b69466c3a5e6c14c48c3c4e80c",
        "registrationState": "committed"
      },
      {
        "contractId": "agent-brief-requirements-fingerprint",
        "repository": "mcp-mamono210/redmine",
        "path": "docs/contracts/agent-brief-requirements-fingerprint-contract.md",
        "semanticRevision": 1,
        "sourceRevision": "facfacebd6854651721eb41aaff8cdb4e5a3cdfa",
        "sourceBlobSha": "b1cca0a47e8c5a6960f11e5bbdb882b15bd3e723",
        "registrationState": "committed"
      },
      {
        "contractId": "agent-runner-execution-boundary",
        "repository": "mcp-mamono210/redmine",
        "path": "docs/contracts/agent-runner-execution-boundary-contract.md",
        "semanticRevision": 1,
        "sourceRevision": "facfacebd6854651721eb41aaff8cdb4e5a3cdfa",
        "sourceBlobSha": "1aa58f442627419e34e6acfce0376c57d614f0f9",
        "registrationState": "committed"
      },
      {
        "contractId": "agent-runner-execution-input",
        "repository": "mcp-mamono210/redmine",
        "path": "docs/contracts/agent-runner-execution-input-contract.md",
        "semanticRevision": 1,
        "sourceRevision": "facfacebd6854651721eb41aaff8cdb4e5a3cdfa",
        "sourceBlobSha": "10203a9c998fbe4f23c6830148d33aba561dbbb7",
        "registrationState": "committed"
      },
      {
        "contractId": "agent-runner-security-sandbox",
        "repository": "mcp-mamono210/redmine",
        "path": "docs/contracts/agent-runner-security-sandbox-contract.md",
        "semanticRevision": 1,
        "sourceRevision": "facfacebd6854651721eb41aaff8cdb4e5a3cdfa",
        "sourceBlobSha": "d86afc0acbbd608b5a7c9b36a8c701e58ee634b9",
        "registrationState": "committed"
      },
      {
        "contractId": "phase49-artifact",
        "repository": "mcp-mamono210/ai-agent-runner",
        "path": "docs/contracts/phase49-artifact-contract.md",
        "semanticRevision": 1,
        "sourceRevision": "15e2683ecd3a6571930d79bcabbfbf6d95d628c2",
        "sourceBlobSha": "69989af90c7066e00a5c87e85735128c57b159a2",
        "registrationState": "committed"
      },
      {
        "contractId": "system-release-compatibility",
        "repository": "mcp-mamono210/redmine",
        "path": "docs/contracts/system-release-compatibility-contract.md",
        "semanticRevision": 2,
        "sourceRevision": "ff271835f57b2c947c2dbe291cc247574dee8a2d",
        "sourceBlobSha": "74a46f4740d53d2b12f51e3ea30be692e0a5e321",
        "registrationState": "committed"
      }
    ]
  },
  "history": [],
  "supersedes": null
}
